{"assets":[],"credits":[{"license":"CC BY-SA 4.0","sourceUrl":"https://en.wikivoyage.org/wiki/Amharic_phrasebook","text":"Phrases from the FSI Amharic Basic Course (public domain), Wikivoyage contributors \"Amharic phrasebook\", and Omniglot; native-speaker review pending."}],"id":"pack.amharic.cafe","language":{"code":"am","id":"am","name":"Amharic"},"lessons":[{"activities":[{"id":"pack.amharic.cafe-conversation-setup","kind":"reflection","prompt":"Hanna stops at a small café (buna bet) in Addis Ababa."},{"audioAssetId":null,"id":"pack.amharic.cafe-conversation-t1","kind":"dialogue_turn","linkedPhraseId":null,"speaker":"Waiter","text":"Selam","translation":"Hello"},{"audioAssetId":null,"id":"pack.amharic.cafe-conversation-t2","kind":"dialogue_turn","linkedPhraseId":null,"speaker":"Hanna","text":"Buna be wetet","translation":"Coffee with milk"},{"audioAssetId":null,"id":"pack.amharic.cafe-conversation-t3","kind":"dialogue_turn","linkedPhraseId":null,"speaker":"Hanna","text":"Sint new?","translation":"How much is it?"},{"audioAssetId":null,"id":"pack.amharic.cafe-conversation-t4","kind":"dialogue_turn","linkedPhraseId":null,"speaker":"Hanna","text":"Amesegnalehu","translation":"Thank you"},{"audioAssetId":null,"id":"pack.amharic.cafe-conversation-t5","kind":"dialogue_turn","linkedPhraseId":null,"speaker":"Hanna","text":"Ibákkiwo. Yet?","translation":"Excuse me. Where?"},{"audioAssetId":null,"id":"pack.amharic.cafe-conversation-t6","kind":"dialogue_turn","linkedPhraseId":null,"speaker":"Waiter","text":"Kirb new. BesteKeññiwo new","translation":"It's nearby. It's on your right"},{"id":"pack.amharic.cafe-conversation-reply","kind":"choice","task":{"acceptedChoiceIds":["c1"],"choices":[{"id":"c1","text":"Siga albelam"},{"id":"c2","text":"Melkam migib"},{"id":"c3","text":"Sint new?"}],"feedbackCorrect":"Right: Siga albelam — I don't eat meat.","feedbackIncorrect":"Melkam migib wishes someone a good meal, and Sint new? asks a price.","id":"reply-task","prompt":"The waiter recommends doro wet (chicken stew), but you don't eat meat. What do you say?"}},{"id":"pack.amharic.cafe-conversation-say","kind":"speaking_prompt","prompt":"Order a coffee aloud, then ask how much it is."}],"format":"guided_conversation","id":"pack.amharic.cafe-conversation","linkedPhraseIds":[],"objective":"Follow Hanna ordering coffee and asking the way, then choose how to decline meat.","prerequisiteLessonIds":[],"requiredActivityIds":["pack.amharic.cafe-conversation-t1","pack.amharic.cafe-conversation-t2","pack.amharic.cafe-conversation-t3","pack.amharic.cafe-conversation-t4","pack.amharic.cafe-conversation-t5","pack.amharic.cafe-conversation-t6","pack.amharic.cafe-conversation-reply"],"revision":1,"title":"At the buna bet"},{"activities":[{"examples":["Kirb new (It's nearby) / RuK new (It's far)","Fitlefit new (It's in front of you)","Sint new? (How much is it?)"],"explanation":"New at the end of these phrases works like 'it is': put the description first. The same word ends the price question and your name.","id":"pack.amharic.cafe-pattern-explain","kind":"pattern_explanation"},{"id":"pack.amharic.cafe-pattern-build-1","kind":"ordered_tokens","task":{"acceptedSequences":[["tok2","tok1"]],"feedbackCorrect":"Right: RuK new.","feedbackIncorrect":"The description comes first, new last.","id":"build-1-task","prompt":"Say that it's far.","tokens":[{"occurrenceId":"tok1","text":"new"},{"occurrenceId":"tok2","text":"RuK"}]}},{"id":"pack.amharic.cafe-pattern-build-2","kind":"ordered_tokens","task":{"acceptedSequences":[["tok2","tok3","tok1"]],"feedbackCorrect":"Right: Buna be wetet.","feedbackIncorrect":"Start with buna (coffee).","id":"build-2-task","prompt":"Order coffee with milk.","tokens":[{"occurrenceId":"tok1","text":"wetet"},{"occurrenceId":"tok2","text":"Buna"},{"occurrenceId":"tok3","text":"be"}]}}],"format":"pattern_workshop","id":"pack.amharic.cafe-pattern","linkedPhraseIds":[],"objective":"Notice how many short answers end in new (it is), then build two.","prerequisiteLessonIds":["pack.amharic.cafe-conversation"],"requiredActivityIds":["pack.amharic.cafe-pattern-explain","pack.amharic.cafe-pattern-build-1","pack.amharic.cafe-pattern-build-2"],"revision":1,"title":"It is …: sentences ending in new"},{"activities":[{"audioAssetId":null,"id":"pack.amharic.cafe-story-n1","kind":"dialogue_turn","linkedPhraseId":null,"speaker":"Story","text":"Dawit is meeting Hanna for coffee but cannot find the café. He asks a shopkeeper:","translation":null},{"audioAssetId":null,"id":"pack.amharic.cafe-story-s1","kind":"dialogue_turn","linkedPhraseId":null,"speaker":"Dawit","text":"Ibákkiwo. Yet?","translation":"Excuse me. Where?"},{"audioAssetId":null,"id":"pack.amharic.cafe-story-s2","kind":"dialogue_turn","linkedPhraseId":null,"speaker":"Shopkeeper","text":"Wedefit yihidunná, wedegrá yizuru","translation":"Go straight ahead and turn"},{"audioAssetId":null,"id":"pack.amharic.cafe-story-s3","kind":"dialogue_turn","linkedPhraseId":null,"speaker":"Shopkeeper","text":"Kirb new","translation":"It's nearby"},{"audioAssetId":null,"id":"pack.amharic.cafe-story-n2","kind":"dialogue_turn","linkedPhraseId":null,"speaker":"Story","text":"He finds Hanna already eating bread with her coffee. He says:","translation":null},{"audioAssetId":null,"id":"pack.amharic.cafe-story-s4","kind":"dialogue_turn","linkedPhraseId":null,"speaker":"Dawit","text":"Melkam migib","translation":"Enjoy your meal"},{"id":"pack.amharic.cafe-story-check","kind":"choice","task":{"acceptedChoiceIds":["c1"],"choices":[{"id":"c1","text":"No — Kirb new"},{"id":"c2","text":"Yes — RuK new"},{"id":"c3","text":"It's behind him"}],"feedbackCorrect":"Right: it's nearby.","feedbackIncorrect":"Look at the shopkeeper's last line.","id":"check-task","prompt":"Is the café far from the shop?"}},{"audioAssetId":null,"comprehension":{"kind":"choice_task","task":{"acceptedChoiceIds":["c3"],"choices":[{"id":"c1","text":"Yet?"},{"id":"c2","text":"Melkam migib"},{"id":"c3","text":"Kirb new"}],"feedbackCorrect":"Correct.","feedbackIncorrect":"Listen again and check the transcript.","id":"listen-comprehension","prompt":"Which line means 'It's nearby'?"}},"id":"pack.amharic.cafe-story-listen","kind":"listening","transcript":"Yet? / Kirb new / Melkam migib","translation":"Where? / It's nearby / Enjoy your meal","unavailableReason":"There is no genuine recording of these lines yet. Root will not stand in a synthetic or unrelated voice, so this listening step opens once a real speaker has recorded it. The story and its question above count on their own."}],"format":"listening","id":"pack.amharic.cafe-story","linkedPhraseIds":[],"objective":"Follow Dawit looking for the café, then answer a question.","prerequisiteLessonIds":["pack.amharic.cafe-conversation"],"requiredActivityIds":["pack.amharic.cafe-story-n1","pack.amharic.cafe-story-s1","pack.amharic.cafe-story-s2","pack.amharic.cafe-story-s3","pack.amharic.cafe-story-n2","pack.amharic.cafe-story-s4","pack.amharic.cafe-story-check"],"revision":1,"title":"Story: Finding the café"}],"minReaderVersion":1,"objective":"Order in a café, say what you don't eat, and follow simple directions.","phrases":[],"publication":"development","schemaVersion":1,"title":"Coffee, food, and directions","version":1}