{"assets":[],"credits":[{"license":"CC BY-SA 4.0","sourceUrl":"https://en.wikivoyage.org/wiki/Luo_phrasebook","text":"Phrases from Wikivoyage contributors, \"Luo phrasebook\", spelling normalized to dh; native-speaker review pending."}],"id":"pack.dholuo.market","language":{"code":"luo","id":"luo","name":"Dholuo"},"lessons":[{"activities":[{"id":"pack.dholuo.market-conversation-setup","kind":"reflection","prompt":"Otieno meets a visitor outside his home in Kisumu."},{"audioAssetId":null,"id":"pack.dholuo.market-conversation-t1","kind":"dialogue_turn","linkedPhraseId":null,"speaker":"Visitor","text":"Amosi","translation":"Hello"},{"audioAssetId":null,"id":"pack.dholuo.market-conversation-t2","kind":"dialogue_turn","linkedPhraseId":null,"speaker":"Otieno","text":"Amosi","translation":"Hello"},{"audioAssetId":null,"id":"pack.dholuo.market-conversation-t3","kind":"dialogue_turn","linkedPhraseId":null,"speaker":"Visitor","text":"Nyingi ng'a?","translation":"What's your name?"},{"audioAssetId":null,"id":"pack.dholuo.market-conversation-t4","kind":"dialogue_turn","linkedPhraseId":null,"speaker":"Otieno","text":"Nyinga Otieno","translation":"My name is Otieno"},{"audioAssetId":null,"id":"pack.dholuo.market-conversation-t5","kind":"dialogue_turn","linkedPhraseId":null,"speaker":"Visitor","text":"To ia kanye?","translation":"Where are you from?"},{"audioAssetId":null,"id":"pack.dholuo.market-conversation-t6","kind":"dialogue_turn","linkedPhraseId":null,"speaker":"Otieno","text":"Aa ki Kisumu","translation":"I'm from Kisumu"},{"audioAssetId":null,"id":"pack.dholuo.market-conversation-t7","kind":"dialogue_turn","linkedPhraseId":null,"speaker":"Visitor","text":"Amor kuom rado kodi","translation":"Nice to meet you"},{"id":"pack.dholuo.market-conversation-reply","kind":"choice","task":{"acceptedChoiceIds":["c1"],"choices":[{"id":"c1","text":"Nyinga …"},{"id":"c2","text":"Aa ki …"},{"id":"c3","text":"Ok ang'eyo"}],"feedbackCorrect":"Right: Nyinga … — my name is …","feedbackIncorrect":"Nyingi ng'a? asks for your name.","id":"reply-task","prompt":"Someone asks you \"Nyingi ng'a?\". Which reply fits?"}},{"id":"pack.dholuo.market-conversation-say","kind":"speaking_prompt","prompt":"Introduce yourself aloud with Nyinga … and Aa ki …"}],"format":"guided_conversation","id":"pack.dholuo.market-conversation","linkedPhraseIds":[],"objective":"Follow Otieno meeting a visitor, then pick the reply to a name question.","prerequisiteLessonIds":[],"requiredActivityIds":["pack.dholuo.market-conversation-t1","pack.dholuo.market-conversation-t2","pack.dholuo.market-conversation-t3","pack.dholuo.market-conversation-t4","pack.dholuo.market-conversation-t5","pack.dholuo.market-conversation-t6","pack.dholuo.market-conversation-t7","pack.dholuo.market-conversation-reply"],"revision":1,"title":"A visitor in Kisumu"},{"activities":[{"examples":["Achiel, ariyo, adek, ang'wen, abich (1–5)","Nyingi ng'a? (What's your name?) → Nyinga … (My name is …)"],"explanation":"Counting from one to five: achiel, ariyo, adek, ang'wen, abich. Ten is apar. Separately, nyingi (your name) and nyinga (my name) differ only in their ending.","id":"pack.dholuo.market-pattern-explain","kind":"pattern_explanation"},{"id":"pack.dholuo.market-pattern-build-1","kind":"ordered_tokens","task":{"acceptedSequences":[["tok2","tok4","tok1","tok5","tok3"]],"feedbackCorrect":"Right: achiel, ariyo, adek, ang'wen, abich.","feedbackIncorrect":"Start with achiel (one).","id":"build-1-task","prompt":"Put one to five in order.","tokens":[{"occurrenceId":"tok1","text":"Adek"},{"occurrenceId":"tok2","text":"Achiel"},{"occurrenceId":"tok3","text":"Abich"},{"occurrenceId":"tok4","text":"Ariyo"},{"occurrenceId":"tok5","text":"Ang'wen"}]}},{"id":"pack.dholuo.market-pattern-build-2","kind":"ordered_tokens","task":{"acceptedSequences":[["tok2","tok1"]],"feedbackCorrect":"Right: Nyingi ng'a?","feedbackIncorrect":"Nyingi (your name) comes first.","id":"build-2-task","prompt":"Ask someone their name.","tokens":[{"occurrenceId":"tok1","text":"ng'a?"},{"occurrenceId":"tok2","text":"Nyingi"}]}}],"format":"pattern_workshop","id":"pack.dholuo.market-pattern","linkedPhraseIds":[],"objective":"Put the numbers in order, and see how 'your name' becomes 'my name'.","prerequisiteLessonIds":["pack.dholuo.market-conversation"],"requiredActivityIds":["pack.dholuo.market-pattern-explain","pack.dholuo.market-pattern-build-1","pack.dholuo.market-pattern-build-2"],"revision":1,"title":"Counting one to five"},{"activities":[{"audioAssetId":null,"id":"pack.dholuo.market-story-n1","kind":"dialogue_turn","linkedPhraseId":null,"speaker":"Story","text":"Otieno is hungry on his way home. He tells his friend:","translation":null},{"audioAssetId":null,"id":"pack.dholuo.market-story-s1","kind":"dialogue_turn","linkedPhraseId":null,"speaker":"Otieno","text":"Adwaro chiemo","translation":"I want to eat"},{"audioAssetId":null,"id":"pack.dholuo.market-story-n2","kind":"dialogue_turn","linkedPhraseId":null,"speaker":"Story","text":"At the market he checks his pocket and smiles:","translation":null},{"audioAssetId":null,"id":"pack.dholuo.market-story-s2","kind":"dialogue_turn","linkedPhraseId":null,"speaker":"Otieno","text":"An gi pesa","translation":"I have money"},{"audioAssetId":null,"id":"pack.dholuo.market-story-n3","kind":"dialogue_turn","linkedPhraseId":null,"speaker":"Story","text":"He buys fish from the lake and some bananas:","translation":null},{"audioAssetId":null,"id":"pack.dholuo.market-story-s3","kind":"dialogue_turn","linkedPhraseId":null,"speaker":"Otieno","text":"Rech. Rabolo","translation":"Fish. Banana"},{"audioAssetId":null,"id":"pack.dholuo.market-story-n4","kind":"dialogue_turn","linkedPhraseId":null,"speaker":"Story","text":"He thanks the seller on the way out:","translation":null},{"audioAssetId":null,"id":"pack.dholuo.market-story-s4","kind":"dialogue_turn","linkedPhraseId":null,"speaker":"Otieno","text":"Erokamano","translation":"Thank you"},{"id":"pack.dholuo.market-story-check","kind":"choice","task":{"acceptedChoiceIds":["c1"],"choices":[{"id":"c1","text":"Rech and rabolo"},{"id":"c2","text":"Bando and alot"},{"id":"c3","text":"Makati and tong'"}],"feedbackCorrect":"Right: fish and bananas.","feedbackIncorrect":"Look again at what he bought.","id":"check-task","prompt":"What did Otieno buy?"}},{"audioAssetId":null,"comprehension":{"kind":"choice_task","task":{"acceptedChoiceIds":["c1"],"choices":[{"id":"c1","text":"An gi pesa"},{"id":"c2","text":"Adwaro chiemo"},{"id":"c3","text":"Erokamano"}],"feedbackCorrect":"Correct.","feedbackIncorrect":"Listen again and check the transcript.","id":"listen-comprehension","prompt":"Which line means 'I have money'?"}},"id":"pack.dholuo.market-story-listen","kind":"listening","transcript":"Adwaro chiemo / An gi pesa / Erokamano","translation":"I want to eat / I have money / Thank you","unavailableReason":"There is no genuine recording of these lines yet. Root will not stand in a synthetic or unrelated voice, so this listening step opens once a real speaker has recorded it. The story and its question above count on their own."}],"format":"listening","id":"pack.dholuo.market-story","linkedPhraseIds":[],"objective":"Follow Otieno shopping for supper, then answer a question.","prerequisiteLessonIds":["pack.dholuo.market-conversation"],"requiredActivityIds":["pack.dholuo.market-story-n1","pack.dholuo.market-story-s1","pack.dholuo.market-story-n2","pack.dholuo.market-story-s2","pack.dholuo.market-story-n3","pack.dholuo.market-story-s3","pack.dholuo.market-story-n4","pack.dholuo.market-story-s4","pack.dholuo.market-story-check"],"revision":1,"title":"Story: Supper from the market"}],"minReaderVersion":1,"objective":"Introduce yourself, count to five, and shop for food.","phrases":[],"publication":"development","schemaVersion":1,"title":"Names, numbers, and the market","version":1}