{"assets":[],"credits":[{"license":"CC BY-SA 4.0","sourceUrl":"https://en.wikivoyage.org/wiki/Amharic_phrasebook","text":"Phrases from the FSI Amharic Basic Course (public domain), Wikivoyage contributors \"Amharic phrasebook\", and Omniglot; native-speaker review pending."}],"id":"pack.amharic.meeting","language":{"code":"am","id":"am","name":"Amharic"},"lessons":[{"activities":[{"id":"pack.amharic.meeting-conversation-setup","kind":"reflection","prompt":"Hanna meets Dawit for the first time. Amharic questions change depending on whether you speak to a man or a woman."},{"audioAssetId":null,"id":"pack.amharic.meeting-conversation-t1","kind":"dialogue_turn","linkedPhraseId":null,"speaker":"Hanna","text":"Selam (ሰላም)","translation":"Hello"},{"audioAssetId":null,"id":"pack.amharic.meeting-conversation-t2","kind":"dialogue_turn","linkedPhraseId":null,"speaker":"Dawit","text":"Tena yisTilliñ, indemin adderu","translation":"Good morning, how are you?"},{"audioAssetId":null,"id":"pack.amharic.meeting-conversation-t3","kind":"dialogue_turn","linkedPhraseId":null,"speaker":"Hanna","text":"Dehna, igziyabher yimmesgen","translation":"Very well, thank you"},{"audioAssetId":null,"id":"pack.amharic.meeting-conversation-t4","kind":"dialogue_turn","linkedPhraseId":null,"speaker":"Hanna","text":"Simih man new? (ስምህ ማን ነው?)","translation":"What is your name? (to a man)"},{"audioAssetId":null,"id":"pack.amharic.meeting-conversation-t5","kind":"dialogue_turn","linkedPhraseId":null,"speaker":"Dawit","text":"Sime Dawit new (ስሜ ዳዊት ነው)","translation":"My name is Dawit"},{"audioAssetId":null,"id":"pack.amharic.meeting-conversation-t6","kind":"dialogue_turn","linkedPhraseId":null,"speaker":"Hanna","text":"Siletewawekin des bilognal","translation":"Pleased to meet you"},{"id":"pack.amharic.meeting-conversation-reply","kind":"choice","task":{"acceptedChoiceIds":["c1"],"choices":[{"id":"c1","text":"Simish man new?"},{"id":"c2","text":"Simih man new?"},{"id":"c3","text":"Sint new?"}],"feedbackCorrect":"Right: Simish is the form used to a woman.","feedbackIncorrect":"Simih is used to a man, and Sint new? asks a price.","id":"reply-task","prompt":"Now Dawit asks Hanna her name. Which question does he use?"}},{"id":"pack.amharic.meeting-conversation-say","kind":"speaking_prompt","prompt":"Say your own name aloud with Sime … new."}],"format":"guided_conversation","id":"pack.amharic.meeting-conversation","linkedPhraseIds":[],"objective":"Follow Hanna and Dawit meeting at a friend's house, then choose the right name question.","prerequisiteLessonIds":[],"requiredActivityIds":["pack.amharic.meeting-conversation-t1","pack.amharic.meeting-conversation-t2","pack.amharic.meeting-conversation-t3","pack.amharic.meeting-conversation-t4","pack.amharic.meeting-conversation-t5","pack.amharic.meeting-conversation-t6","pack.amharic.meeting-conversation-reply"],"revision":1,"title":"Hanna meets Dawit"},{"activities":[{"examples":["Simih man new? (What is your name? — to a man)","Simish man new? (What is your name? — to a woman)","Sime … new (My name is …)"],"explanation":"In these phrases the word for your changes with the person you speak to: simih (your name, to a man) and simish (your name, to a woman). Sime is my name.","id":"pack.amharic.meeting-pattern-explain","kind":"pattern_explanation"},{"id":"pack.amharic.meeting-pattern-build-1","kind":"ordered_tokens","task":{"acceptedSequences":[["tok2","tok3","tok1"]],"feedbackCorrect":"Right: Simish man new?","feedbackIncorrect":"Start with Simish (your name, to a woman).","id":"build-1-task","prompt":"Ask a woman her name.","tokens":[{"occurrenceId":"tok1","text":"new?"},{"occurrenceId":"tok2","text":"Simish"},{"occurrenceId":"tok3","text":"man"}]}},{"id":"pack.amharic.meeting-pattern-build-2","kind":"ordered_tokens","task":{"acceptedSequences":[["tok3","tok1","tok2"]],"feedbackCorrect":"Right: Sime Hanna new.","feedbackIncorrect":"Sime first, the name in the middle, new at the end.","id":"build-2-task","prompt":"Say \"My name is Hanna\".","tokens":[{"occurrenceId":"tok1","text":"Hanna"},{"occurrenceId":"tok2","text":"new"},{"occurrenceId":"tok3","text":"Sime"}]}}],"format":"pattern_workshop","id":"pack.amharic.meeting-pattern","linkedPhraseIds":[],"objective":"Notice the ending that changes for a man or a woman, then build both questions.","prerequisiteLessonIds":["pack.amharic.meeting-conversation"],"requiredActivityIds":["pack.amharic.meeting-pattern-explain","pack.amharic.meeting-pattern-build-1","pack.amharic.meeting-pattern-build-2"],"revision":1,"title":"Speaking to a man or a woman"},{"activities":[{"audioAssetId":null,"id":"pack.amharic.meeting-story-n1","kind":"dialogue_turn","linkedPhraseId":null,"speaker":"Story","text":"Dawit's colleague is surprised to hear him greet her in Amharic. She asks:","translation":null},{"audioAssetId":null,"id":"pack.amharic.meeting-story-s1","kind":"dialogue_turn","linkedPhraseId":null,"speaker":"Colleague","text":"Amariñña yawKallu?","translation":"Do you know Amharic?"},{"audioAssetId":null,"id":"pack.amharic.meeting-story-s2","kind":"dialogue_turn","linkedPhraseId":null,"speaker":"Dawit","text":"Tinniš awKallehu","translation":"I know a little"},{"audioAssetId":null,"id":"pack.amharic.meeting-story-n2","kind":"dialogue_turn","linkedPhraseId":null,"speaker":"Story","text":"She answers quickly and he misses it:","translation":null},{"audioAssetId":null,"id":"pack.amharic.meeting-story-s3","kind":"dialogue_turn","linkedPhraseId":null,"speaker":"Dawit","text":"Minalu? Algebagnim","translation":"What did you say? I don't understand"},{"audioAssetId":null,"id":"pack.amharic.meeting-story-n3","kind":"dialogue_turn","linkedPhraseId":null,"speaker":"Story","text":"She laughs, says it again slowly, and he thanks her before leaving:","translation":null},{"audioAssetId":null,"id":"pack.amharic.meeting-story-s4","kind":"dialogue_turn","linkedPhraseId":null,"speaker":"Dawit","text":"Amesegnalehu. Chaw","translation":"Thank you. Bye"},{"id":"pack.amharic.meeting-story-check","kind":"choice","task":{"acceptedChoiceIds":["c1"],"choices":[{"id":"c1","text":"Tinniš awKallehu (a little)"},{"id":"c2","text":"Yellem, alawKim (none)"},{"id":"c3","text":"Awo, awKallehu (yes, I know it)"}],"feedbackCorrect":"Right: he knows a little.","feedbackIncorrect":"Look at his first answer.","id":"check-task","prompt":"How much Amharic does Dawit say he knows?"}},{"audioAssetId":null,"comprehension":{"kind":"choice_task","task":{"acceptedChoiceIds":["c2"],"choices":[{"id":"c1","text":"Minalu?"},{"id":"c2","text":"Amesegnalehu"},{"id":"c3","text":"Tinniš awKallehu"}],"feedbackCorrect":"Correct.","feedbackIncorrect":"Listen again and check the transcript.","id":"listen-comprehension","prompt":"Which line means 'Thank you'?"}},"id":"pack.amharic.meeting-story-listen","kind":"listening","transcript":"Tinniš awKallehu / Minalu? / Amesegnalehu","translation":"I know a little / What did you say? / Thank you","unavailableReason":"There is no genuine recording of these lines yet. Root will not stand in a synthetic or unrelated voice, so this listening step opens once a real speaker has recorded it. The story and its question above count on their own."}],"format":"listening","id":"pack.amharic.meeting-story","linkedPhraseIds":[],"objective":"Read about Dawit practising his Amharic, then answer a question.","prerequisiteLessonIds":["pack.amharic.meeting-conversation"],"requiredActivityIds":["pack.amharic.meeting-story-n1","pack.amharic.meeting-story-s1","pack.amharic.meeting-story-s2","pack.amharic.meeting-story-n2","pack.amharic.meeting-story-s3","pack.amharic.meeting-story-n3","pack.amharic.meeting-story-s4","pack.amharic.meeting-story-check"],"revision":1,"title":"Story: Dawit's first lesson"}],"minReaderVersion":1,"objective":"Greet someone, ask their name the right way for a man or a woman, and say how much Amharic you know.","phrases":[],"publication":"development","schemaVersion":1,"title":"Greetings and introductions","version":1}