{"assets":[],"credits":[{"license":"CC BY-SA 4.0","sourceUrl":"https://en.wikivoyage.org/wiki/Swahili_phrasebook","text":"Phrases from Wikivoyage contributors, \"Swahili phrasebook\", and Omniglot \"Useful Swahili phrases\"; native-speaker review pending."}],"id":"pack.swahili.market","language":{"code":"sw","id":"sw","name":"Swahili"},"lessons":[{"activities":[{"id":"pack.swahili.market-conversation-setup","kind":"reflection","prompt":"Amina stops at a tea stall in the market."},{"audioAssetId":null,"id":"pack.swahili.market-conversation-t1","kind":"dialogue_turn","linkedPhraseId":null,"speaker":"Vendor","text":"Karibu","translation":"Welcome"},{"audioAssetId":null,"id":"pack.swahili.market-conversation-t2","kind":"dialogue_turn","linkedPhraseId":null,"speaker":"Amina","text":"Naomba chai ya maziwa","translation":"I'd like tea with milk"},{"audioAssetId":null,"id":"pack.swahili.market-conversation-t3","kind":"dialogue_turn","linkedPhraseId":null,"speaker":"Amina","text":"Hii ni bei gani?","translation":"How much is this?"},{"audioAssetId":null,"id":"pack.swahili.market-conversation-t4","kind":"dialogue_turn","linkedPhraseId":null,"speaker":"Amina","text":"Asante","translation":"Thank you"},{"audioAssetId":null,"id":"pack.swahili.market-conversation-t5","kind":"dialogue_turn","linkedPhraseId":null,"speaker":"Vendor","text":"Karibu","translation":"You're welcome"},{"audioAssetId":null,"id":"pack.swahili.market-conversation-t6","kind":"dialogue_turn","linkedPhraseId":null,"speaker":"Amina","text":"Choo kiko wapi?","translation":"Where is the toilet?"},{"audioAssetId":null,"id":"pack.swahili.market-conversation-t7","kind":"dialogue_turn","linkedPhraseId":null,"speaker":"Vendor","text":"Pinda kushoto","translation":"Turn left"},{"id":"pack.swahili.market-conversation-reply","kind":"choice","task":{"acceptedChoiceIds":["c1"],"choices":[{"id":"c1","text":"Hapana, asante"},{"id":"c2","text":"Naomba …"},{"id":"c3","text":"Hii ni bei gani?"}],"feedbackCorrect":"Right: Hapana, asante — no, thank you.","feedbackIncorrect":"You want to refuse politely.","id":"reply-task","prompt":"The vendor offers a second cup but you've had enough. What do you say?"}},{"id":"pack.swahili.market-conversation-say","kind":"speaking_prompt","prompt":"Order something you like with Naomba …, then ask the price."}],"format":"guided_conversation","id":"pack.swahili.market-conversation","linkedPhraseIds":[],"objective":"Follow Amina buying tea and asking the way, then choose a polite refusal.","prerequisiteLessonIds":[],"requiredActivityIds":["pack.swahili.market-conversation-t1","pack.swahili.market-conversation-t2","pack.swahili.market-conversation-t3","pack.swahili.market-conversation-t4","pack.swahili.market-conversation-t5","pack.swahili.market-conversation-t6","pack.swahili.market-conversation-t7","pack.swahili.market-conversation-reply"],"revision":1,"title":"Tea at the market"},{"activities":[{"examples":["Pinda kushoto (Turn left) / Pinda kulia (Turn right)","Naomba chai ya maziwa (I'd like tea with milk)","Naomba bili, tafadhali (The bill, please)"],"explanation":"Pinda means turn; add the direction after it. Naomba (I'd like / may I have) goes before the thing you want and sounds more polite than Ninataka (I want).","id":"pack.swahili.market-pattern-explain","kind":"pattern_explanation"},{"id":"pack.swahili.market-pattern-build-1","kind":"ordered_tokens","task":{"acceptedSequences":[["tok2","tok1"]],"feedbackCorrect":"Right: Pinda kulia.","feedbackIncorrect":"Pinda comes first.","id":"build-1-task","prompt":"Tell a driver to turn right.","tokens":[{"occurrenceId":"tok1","text":"kulia"},{"occurrenceId":"tok2","text":"Pinda"}]}},{"id":"pack.swahili.market-pattern-build-2","kind":"ordered_tokens","task":{"acceptedSequences":[["tok3","tok2","tok1"]],"feedbackCorrect":"Right: Naomba bili, tafadhali.","feedbackIncorrect":"Start with Naomba and finish with tafadhali (please).","id":"build-2-task","prompt":"Ask for the bill politely.","tokens":[{"occurrenceId":"tok1","text":"tafadhali"},{"occurrenceId":"tok2","text":"bili,"},{"occurrenceId":"tok3","text":"Naomba"}]}}],"format":"pattern_workshop","id":"pack.swahili.market-pattern","linkedPhraseIds":[],"objective":"Use Pinda with a direction, and Naomba to ask for something politely.","prerequisiteLessonIds":["pack.swahili.market-conversation"],"requiredActivityIds":["pack.swahili.market-pattern-explain","pack.swahili.market-pattern-build-1","pack.swahili.market-pattern-build-2"],"revision":1,"title":"Turning and asking"},{"activities":[{"audioAssetId":null,"id":"pack.swahili.market-story-n1","kind":"dialogue_turn","linkedPhraseId":null,"speaker":"Story","text":"After the market, Amina takes a wrong turn in the narrow streets. She stops someone:","translation":null},{"audioAssetId":null,"id":"pack.swahili.market-story-s1","kind":"dialogue_turn","linkedPhraseId":null,"speaker":"Amina","text":"Samahani. Nimepotea","translation":"Excuse me. I'm lost"},{"audioAssetId":null,"id":"pack.swahili.market-story-n2","kind":"dialogue_turn","linkedPhraseId":null,"speaker":"Story","text":"The man points down the road:","translation":null},{"audioAssetId":null,"id":"pack.swahili.market-story-s2","kind":"dialogue_turn","linkedPhraseId":null,"speaker":"Man","text":"Moja kwa moja","translation":"Straight ahead"},{"audioAssetId":null,"id":"pack.swahili.market-story-n3","kind":"dialogue_turn","linkedPhraseId":null,"speaker":"Story","text":"She finds a taxi and shows the driver the address:","translation":null},{"audioAssetId":null,"id":"pack.swahili.market-story-s3","kind":"dialogue_turn","linkedPhraseId":null,"speaker":"Amina","text":"Nipeleke huko, tafadhali","translation":"Take me there, please"},{"audioAssetId":null,"id":"pack.swahili.market-story-n4","kind":"dialogue_turn","linkedPhraseId":null,"speaker":"Story","text":"Home again, she calls Juma to plan the next day:","translation":null},{"audioAssetId":null,"id":"pack.swahili.market-story-s4","kind":"dialogue_turn","linkedPhraseId":null,"speaker":"Amina","text":"Tutaonana kesho","translation":"See you tomorrow"},{"id":"pack.swahili.market-story-check","kind":"choice","task":{"acceptedChoiceIds":["c1"],"choices":[{"id":"c1","text":"Nimepotea"},{"id":"c2","text":"Moja kwa moja"},{"id":"c3","text":"Tutaonana kesho"}],"feedbackCorrect":"Right: Nimepotea means I'm lost.","feedbackIncorrect":"Look at what Amina said first.","id":"check-task","prompt":"Which phrase did Amina use to say she was lost?"}},{"audioAssetId":null,"comprehension":{"kind":"choice_task","task":{"acceptedChoiceIds":["c1"],"choices":[{"id":"c1","text":"Moja kwa moja"},{"id":"c2","text":"Nimepotea"},{"id":"c3","text":"Tutaonana kesho"}],"feedbackCorrect":"Correct.","feedbackIncorrect":"Listen again and check the transcript.","id":"listen-comprehension","prompt":"Which line gives a direction?"}},"id":"pack.swahili.market-story-listen","kind":"listening","transcript":"Nimepotea / Moja kwa moja / Tutaonana kesho","translation":"I'm lost / Straight ahead / See you tomorrow","unavailableReason":"There is no genuine recording of these lines yet. Root will not stand in a synthetic or unrelated voice, so this listening step opens once a real speaker has recorded it. The story and its question above count on their own."}],"format":"listening","id":"pack.swahili.market-story","linkedPhraseIds":[],"objective":"Follow Amina finding her way back, then answer a question.","prerequisiteLessonIds":["pack.swahili.market-conversation"],"requiredActivityIds":["pack.swahili.market-story-n1","pack.swahili.market-story-s1","pack.swahili.market-story-n2","pack.swahili.market-story-s2","pack.swahili.market-story-n3","pack.swahili.market-story-s3","pack.swahili.market-story-n4","pack.swahili.market-story-s4","pack.swahili.market-story-check"],"revision":1,"title":"Story: Lost in the old town"}],"minReaderVersion":1,"objective":"Ask prices, order politely, and find your way.","phrases":[],"publication":"development","schemaVersion":1,"title":"At the market and around town","version":1}