{"assets":[],"credits":[{"license":"UNKNOWN","sourceUrl":"https://www.omniglot.com/language/phrases/shona.php","text":"Phrases from Omniglot \"Useful Shona phrases\" (Emma Thembani and Ernest Mdende) and Wiktionary; accuracy-checked, native-speaker review pending."}],"id":"pack.shona.meeting","language":{"code":"sn","id":"sn","name":"Shona"},"lessons":[{"activities":[{"id":"pack.shona.meeting-conversation-setup","kind":"reflection","prompt":"Tendai meets Chipo for the first time at a friend's house. Read their exchange in order."},{"audioAssetId":null,"id":"pack.shona.meeting-conversation-t1","kind":"dialogue_turn","linkedPhraseId":null,"speaker":"Tendai","text":"Mhoro","translation":"Hello (one person)"},{"audioAssetId":null,"id":"pack.shona.meeting-conversation-t2","kind":"dialogue_turn","linkedPhraseId":null,"speaker":"Chipo","text":"Wakadini zvako?","translation":"How are you? (one person)"},{"audioAssetId":null,"id":"pack.shona.meeting-conversation-t3","kind":"dialogue_turn","linkedPhraseId":null,"speaker":"Tendai","text":"Ndiripo","translation":"I'm fine"},{"audioAssetId":null,"id":"pack.shona.meeting-conversation-t4","kind":"dialogue_turn","linkedPhraseId":null,"speaker":"Chipo","text":"Unonzani?","translation":"What's your name?"},{"audioAssetId":null,"id":"pack.shona.meeting-conversation-t5","kind":"dialogue_turn","linkedPhraseId":null,"speaker":"Tendai","text":"Ndinonzi Tendai","translation":"My name is Tendai"},{"audioAssetId":null,"id":"pack.shona.meeting-conversation-t6","kind":"dialogue_turn","linkedPhraseId":null,"speaker":"Chipo","text":"Unobva kupi?","translation":"Where are you from?"},{"audioAssetId":null,"id":"pack.shona.meeting-conversation-t7","kind":"dialogue_turn","linkedPhraseId":null,"speaker":"Tendai","text":"Ndinobva kuHarare","translation":"I'm from Harare"},{"audioAssetId":null,"id":"pack.shona.meeting-conversation-t8","kind":"dialogue_turn","linkedPhraseId":null,"speaker":"Chipo","text":"Ndafara kukuziva","translation":"Pleased to meet you"},{"id":"pack.shona.meeting-conversation-reply","kind":"choice","task":{"acceptedChoiceIds":["c1"],"choices":[{"id":"c1","text":"Ndinonzi …"},{"id":"c2","text":"Ndinobva ku…"},{"id":"c3","text":"Sara zvakanaka"}],"feedbackCorrect":"Right: Ndinonzi … (My name is …) answers Unonzani?","feedbackIncorrect":"That answers a different question. Unonzani? asks for your name.","id":"reply-task","prompt":"Chipo's cousin asks you \"Unonzani?\". Which reply fits?"}},{"id":"pack.shona.meeting-conversation-say","kind":"speaking_prompt","prompt":"Say the whole introduction aloud with your own name and home town."}],"format":"guided_conversation","id":"pack.shona.meeting-conversation","linkedPhraseIds":[],"objective":"Follow Tendai and Chipo introducing themselves, then pick the right reply to a name question.","prerequisiteLessonIds":[],"requiredActivityIds":["pack.shona.meeting-conversation-t1","pack.shona.meeting-conversation-t2","pack.shona.meeting-conversation-t3","pack.shona.meeting-conversation-t4","pack.shona.meeting-conversation-t5","pack.shona.meeting-conversation-t6","pack.shona.meeting-conversation-t7","pack.shona.meeting-conversation-t8","pack.shona.meeting-conversation-reply"],"revision":1,"title":"Meeting Chipo"},{"activities":[{"examples":["Unonzani? (What are you called?) → Ndinonzi … (I am called …)","Unobva kupi? (Where are you from?) → Ndinobva ku… (I come from …)"],"explanation":"In these two checked pairs the question to one person starts with U- (you) and the answer starts with Ndi- (I). Treat this as a note about these phrases only, not a rule for every Shona verb; that needs a native speaker to confirm.","id":"pack.shona.meeting-pattern-explain","kind":"pattern_explanation"},{"id":"pack.shona.meeting-pattern-build-1","kind":"ordered_tokens","task":{"acceptedSequences":[["tok2","tok1"]],"feedbackCorrect":"Right: Ndinobva kuHarare.","feedbackIncorrect":"Start with the I-form, Ndinobva.","id":"build-1-task","prompt":"Build \"I'm from Harare\".","tokens":[{"occurrenceId":"tok1","text":"kuHarare"},{"occurrenceId":"tok2","text":"Ndinobva"}]}},{"assistanceHint":"Ndinokumbirawo means 'I kindly ask'.","id":"pack.shona.meeting-pattern-build-2","kind":"ordered_tokens","task":{"acceptedSequences":[["tok3","tok2","tok4","tok1"]],"feedbackCorrect":"Right: Ndinokumbirawo kuti muzvitaure futi — please say that again.","feedbackIncorrect":"It opens with the polite request, Ndinokumbirawo, and ends with futi (again).","id":"build-2-task","prompt":"Ask someone to say it again, politely.","tokens":[{"occurrenceId":"tok1","text":"futi"},{"occurrenceId":"tok2","text":"kuti"},{"occurrenceId":"tok3","text":"Ndinokumbirawo"},{"occurrenceId":"tok4","text":"muzvitaure"}]}}],"format":"pattern_workshop","id":"pack.shona.meeting-pattern","linkedPhraseIds":[],"objective":"Notice how a question to you and its answer about me differ in these checked pairs, then build both.","prerequisiteLessonIds":["pack.shona.meeting-conversation"],"requiredActivityIds":["pack.shona.meeting-pattern-explain","pack.shona.meeting-pattern-build-1","pack.shona.meeting-pattern-build-2"],"revision":1,"title":"You and I: questions and answers"},{"activities":[{"audioAssetId":null,"id":"pack.shona.meeting-story-n1","kind":"dialogue_turn","linkedPhraseId":null,"speaker":"Story","text":"Chipo is leaving for Bulawayo. At the door her grandmother says:","translation":null},{"audioAssetId":null,"id":"pack.shona.meeting-story-s1","kind":"dialogue_turn","linkedPhraseId":null,"speaker":"Grandmother","text":"Ufambe zvakanaka","translation":"Have a good journey"},{"audioAssetId":null,"id":"pack.shona.meeting-story-n2","kind":"dialogue_turn","linkedPhraseId":null,"speaker":"Story","text":"On the bus a man gives her directions, but he talks very fast. Chipo says:","translation":null},{"audioAssetId":null,"id":"pack.shona.meeting-story-s2","kind":"dialogue_turn","linkedPhraseId":null,"speaker":"Chipo","text":"Ndinokumbirawo kuti musakurumidze kutaura","translation":"Please speak more slowly"},{"audioAssetId":null,"id":"pack.shona.meeting-story-n3","kind":"dialogue_turn","linkedPhraseId":null,"speaker":"Story","text":"At the next stop she needs the toilet and asks:","translation":null},{"audioAssetId":null,"id":"pack.shona.meeting-story-s3","kind":"dialogue_turn","linkedPhraseId":null,"speaker":"Chipo","text":"Chimbuzi chiripi?","translation":"Where's the toilet?"},{"audioAssetId":null,"id":"pack.shona.meeting-story-n4","kind":"dialogue_turn","linkedPhraseId":null,"speaker":"Story","text":"The bus starts to pull away without her friend, so she calls out:","translation":null},{"audioAssetId":null,"id":"pack.shona.meeting-story-s4","kind":"dialogue_turn","linkedPhraseId":null,"speaker":"Chipo","text":"Mira!","translation":"Stop!"},{"id":"pack.shona.meeting-story-check","kind":"choice","task":{"acceptedChoiceIds":["c1"],"choices":[{"id":"c1","text":"Ndinokumbirawo kuti musakurumidze kutaura"},{"id":"c2","text":"Ufambe zvakanaka"},{"id":"c3","text":"Mira!"}],"feedbackCorrect":"Right: she asked him to speak more slowly.","feedbackIncorrect":"Look again at what Chipo said after the fast directions.","id":"check-task","prompt":"What did Chipo say when the man spoke too fast?"}},{"audioAssetId":null,"comprehension":{"kind":"choice_task","task":{"acceptedChoiceIds":["c2"],"choices":[{"id":"c1","text":"Mira!"},{"id":"c2","text":"Chimbuzi chiripi?"},{"id":"c3","text":"Ufambe zvakanaka"}],"feedbackCorrect":"Correct.","feedbackIncorrect":"Listen again and check the transcript.","id":"listen-comprehension","prompt":"Which line asks for the toilet?"}},"id":"pack.shona.meeting-story-listen","kind":"listening","transcript":"Ufambe zvakanaka / Chimbuzi chiripi? / Mira!","translation":"Have a good journey / Where's the toilet? / Stop!","unavailableReason":"There is no genuine recording of these lines yet. Root will not stand in a synthetic or unrelated voice, so this listening step opens once a real speaker has recorded it. The story and its question above count on their own."}],"format":"listening","id":"pack.shona.meeting-story","linkedPhraseIds":[],"objective":"Read a short journey told through phrases you know, then answer a question about it.","prerequisiteLessonIds":["pack.shona.meeting-conversation"],"requiredActivityIds":["pack.shona.meeting-story-n1","pack.shona.meeting-story-s1","pack.shona.meeting-story-n2","pack.shona.meeting-story-s2","pack.shona.meeting-story-n3","pack.shona.meeting-story-s3","pack.shona.meeting-story-n4","pack.shona.meeting-story-s4","pack.shona.meeting-story-check"],"revision":1,"title":"Story: Chipo's bus ride"}],"minReaderVersion":1,"objective":"Introduce yourself, ask where someone is from, and handle a journey politely.","phrases":[],"publication":"development","schemaVersion":1,"title":"Meeting people and getting around","version":1}