{"assets":[],"credits":[{"license":"UNKNOWN","sourceUrl":"https://www.omniglot.com/language/phrases/shona.php","text":"Phrase contributors Emma Thembani and Ernest Mdende, via Omniglot \"Useful Shona phrases\" (accuracy-checked, not license-cleared, native-speaker review pending)."}],"id":"pack.shona.pilot.dev","language":{"code":"sn","id":"sn","name":"Shona"},"lessons":[{"activities":[{"id":"scene-setup","kind":"reflection","prompt":"Setting: Tendai visits their neighbor Rudo three times in one day -- once in the morning, once in the afternoon, and once at night to say goodbye. Read the six exchanges below in order, then try the reply question at the end."},{"audioAssetId":null,"id":"t1","kind":"dialogue_turn","linkedPhraseId":"shona-pilot-good-morning","speaker":"Tendai","text":"Mangwanani","translation":"Good morning"},{"audioAssetId":null,"id":"t2","kind":"dialogue_turn","linkedPhraseId":"shona-pilot-welcome","speaker":"Rudo","text":"Mauya","translation":"Welcome"},{"audioAssetId":null,"id":"t3","kind":"dialogue_turn","linkedPhraseId":"shona-pilot-thanks-sg","speaker":"Tendai","text":"Waita zvako","translation":"Thank you (one person)"},{"audioAssetId":null,"id":"t4","kind":"dialogue_turn","linkedPhraseId":"shona-pilot-good-afternoon","speaker":"Tendai","text":"Masikati","translation":"Good afternoon"},{"audioAssetId":null,"id":"t5","kind":"dialogue_turn","linkedPhraseId":"shona-pilot-hello-sg","speaker":"Rudo","text":"Mhoro","translation":"Hello (one person)"},{"audioAssetId":null,"id":"t6","kind":"dialogue_turn","linkedPhraseId":"shona-pilot-good-evening","speaker":"Rudo","text":"Manheru","translation":"Good evening"},{"id":"transfer-1","kind":"choice","task":{"acceptedChoiceIds":["c1"],"choices":[{"id":"c1","text":"Manheru (Good evening)"},{"id":"c2","text":"Mangwanani (Good morning)"},{"id":"c3","text":"Mhoroi (Hello, to a group)"},{"id":"c4","text":"Masikati (Good afternoon)"}],"feedbackCorrect":"Correct: mirroring the same evening greeting back is the natural one-to-one reply.","feedbackIncorrect":"Not quite: this reply either names the wrong time of day or is the group form, not a matching one-person evening farewell.","id":"transfer-1-task","prompt":"As you leave for the night, Rudo says \"Manheru\" to you. What is the appropriate one-person reply?"}}],"format":"guided_conversation","id":"shona-pilot-lesson-greetings","linkedPhraseIds":["shona-pilot-hello-sg","shona-pilot-hello-pl","shona-pilot-welcome","shona-pilot-good-morning","shona-pilot-good-afternoon","shona-pilot-good-evening","shona-pilot-thanks-sg","shona-pilot-thanks-pl"],"objective":"Follow Tendai's day of visits to neighbor Rudo -- a morning arrival, being welcomed in and giving thanks, an afternoon return, and an evening farewell -- through six real Shona greeting/courtesy phrases (each used exactly once, in the time-of-day/register it actually fits), then choose a contextually appropriate reply.","prerequisiteLessonIds":[],"requiredActivityIds":["t1","t2","t3","t4","t5","t6","transfer-1"],"revision":1,"title":"Greetings and Courtesies"},{"activities":[{"audioAssetId":null,"comprehension":{"kind":"choice_task","task":{"acceptedChoiceIds":["w2"],"choices":[{"id":"w1","text":"Mhoro"},{"id":"w2","text":"Mauya"},{"id":"w3","text":"Manheru"}],"feedbackCorrect":"Correct: Mauya means Welcome.","feedbackIncorrect":"Check the transcript/translation pairing above and try again.","id":"listen-1-comprehension","prompt":"Once a real recording exists: which transcript word means \"Welcome\"?"}},"id":"listen-1","kind":"listening","transcript":"Mhoro / Mhoroi / Mauya / Mangwanani / Masikati / Manheru / Waita zvako / Maita zvenyu","translation":"Hello / Hello (group) / Welcome / Good morning / Good afternoon / Good evening / Thank you / Thank you (group)","unavailableReason":"No native-speaker or otherwise authentic recording of this phrase set exists yet. Reusing unrelated benchmark speech or a synthesized voice would misrepresent the audio as authentic, so listening stays explicitly unavailable until a real, consenting recording is obtained."}],"format":"listening","id":"shona-pilot-lesson-listening","linkedPhraseIds":["shona-pilot-hello-sg","shona-pilot-hello-pl","shona-pilot-welcome","shona-pilot-good-morning","shona-pilot-good-afternoon","shona-pilot-good-evening","shona-pilot-thanks-sg","shona-pilot-thanks-pl"],"objective":"Hear the greetings and courtesies from the first lesson spoken by a real speaker, then pick out the word for Welcome.","prerequisiteLessonIds":["shona-pilot-lesson-greetings"],"requiredActivityIds":["listen-1"],"revision":2,"title":"Listen: greetings through the day"},{"activities":[{"examples":["Mhoro (Hello, one person) → Mhoroi (Hello, more than one person)","Waita zvako (Thank you, one person) → Maita zvenyu (Thank you, more than one person)"],"explanation":"Two of this pack's checked phrase pairs change when you address more than one person: Mhoro becomes Mhoroi, and Waita zvako becomes Maita zvenyu. This workshop only demonstrates the pattern for these two already-checked pairs; it is not a general grammar rule for other Shona words, which would need separate native-speaker confirmation.","id":"explain-1","kind":"pattern_explanation"},{"assistanceHint":"This activity is supported: the single token is already the whole answer.","id":"construct-guided-1","kind":"ordered_tokens","task":{"acceptedSequences":[["tok1"]],"feedbackCorrect":"Right: that is the one-person form.","feedbackIncorrect":"This phrase has only one token to place; check the word itself against the earlier lesson.","id":"construct-guided-1-task","prompt":"Build the one-person greeting.","tokens":[{"occurrenceId":"tok1","text":"Mhoro"}]}},{"id":"construct-changed-context-1","kind":"ordered_tokens","task":{"acceptedSequences":[["tok1","tok2"]],"feedbackCorrect":"Right: Maita zvenyu is the group form of Waita zvako, following the same pattern as Mhoro/Mhoroi.","feedbackIncorrect":"Reorder the two words so the group-thanks phrase reads correctly; remember this is the changed-context (plural) counterpart to Waita zvako.","id":"construct-changed-context-1-task","prompt":"Now thank a group of people (not just one person) using the pattern above.","tokens":[{"occurrenceId":"tok1","text":"Maita"},{"occurrenceId":"tok2","text":"zvenyu"}]}}],"format":"pattern_workshop","id":"shona-pilot-lesson-pattern","linkedPhraseIds":["shona-pilot-hello-sg","shona-pilot-hello-pl","shona-pilot-thanks-sg","shona-pilot-thanks-pl"],"objective":"Notice how two of these courtesy phrases change when addressing more than one person, then construct both forms.","prerequisiteLessonIds":["shona-pilot-lesson-greetings"],"requiredActivityIds":["explain-1","construct-guided-1","construct-changed-context-1"],"revision":2,"title":"Address Pattern Workshop"}],"minReaderVersion":1,"objective":"Greet a neighbour through the day, answer naturally, listen for the greetings, and see how two courtesies change for a group.","phrases":[{"audioAssetId":null,"context":"greeting one person","credits":{"license":"UNKNOWN","sourceUrl":"https://www.omniglot.com/language/phrases/shona.php","text":"Phrase contributors Emma Thembani and Ernest Mdende, via Omniglot \"Useful Shona phrases\""},"id":"shona-pilot-hello-sg","meaning":"Hello (one person)","prompt":"Mhoro","register":null},{"audioAssetId":null,"context":"greeting a group","credits":{"license":"UNKNOWN","sourceUrl":"https://www.omniglot.com/language/phrases/shona.php","text":"Phrase contributors Emma Thembani and Ernest Mdende, via Omniglot \"Useful Shona phrases\""},"id":"shona-pilot-hello-pl","meaning":"Hello (more than one person)","prompt":"Mhoroi","register":null},{"audioAssetId":null,"context":null,"credits":{"license":"UNKNOWN","sourceUrl":"https://www.omniglot.com/language/phrases/shona.php","text":"Phrase contributors Emma Thembani and Ernest Mdende, via Omniglot \"Useful Shona phrases\""},"id":"shona-pilot-welcome","meaning":"Welcome","prompt":"Mauya","register":null},{"audioAssetId":null,"context":null,"credits":{"license":"UNKNOWN","sourceUrl":"https://www.omniglot.com/language/phrases/shona.php","text":"Phrase contributors Emma Thembani and Ernest Mdende, via Omniglot \"Useful Shona phrases\""},"id":"shona-pilot-good-morning","meaning":"Good morning","prompt":"Mangwanani","register":null},{"audioAssetId":null,"context":null,"credits":{"license":"UNKNOWN","sourceUrl":"https://www.omniglot.com/language/phrases/shona.php","text":"Phrase contributors Emma Thembani and Ernest Mdende, via Omniglot \"Useful Shona phrases\""},"id":"shona-pilot-good-afternoon","meaning":"Good afternoon","prompt":"Masikati","register":null},{"audioAssetId":null,"context":null,"credits":{"license":"UNKNOWN","sourceUrl":"https://www.omniglot.com/language/phrases/shona.php","text":"Phrase contributors Emma Thembani and Ernest Mdende, via Omniglot \"Useful Shona phrases\""},"id":"shona-pilot-good-evening","meaning":"Good evening","prompt":"Manheru","register":null},{"audioAssetId":null,"context":"thanking one person","credits":{"license":"UNKNOWN","sourceUrl":"https://www.omniglot.com/language/phrases/shona.php","text":"Phrase contributors Emma Thembani and Ernest Mdende, via Omniglot \"Useful Shona phrases\""},"id":"shona-pilot-thanks-sg","meaning":"Thank you (one person)","prompt":"Waita zvako","register":null},{"audioAssetId":null,"context":"thanking a group","credits":{"license":"UNKNOWN","sourceUrl":"https://www.omniglot.com/language/phrases/shona.php","text":"Phrase contributors Emma Thembani and Ernest Mdende, via Omniglot \"Useful Shona phrases\""},"id":"shona-pilot-thanks-pl","meaning":"Thank you (more than one person)","prompt":"Maita zvenyu","register":null}],"publication":"development","schemaVersion":1,"title":"Greetings and courtesies","version":2}